[
  {
    "id": "a0000000-0000-4000-a000-000000000001",
    "description": "## Adventure Overview: The Twisted Glade\n\n**Setting:** Thornfast Keep, Misty Forest, Faerûn (west of Baldur's Gate, near the Greenfields)\n\n**Theme:** Classic D&D fantasy with exploration and combat focus. Fey corruption, reality bleed, and planar sealing.\n\n**Player Level:** 3 (no leveling up during the one-shot)\n\n**Party Hooks:**\n- **For the Warlock (Archfey):** The Thorned One is a fallen cousin of your patron. The Gleaming Accord watches this mission closely — success may earn their favor.\n- **For the Paladin (Oath of Glory):** Thornfast Keep is a place where elven heroes once stood. Your oath calls you to prove your worth in these ancient halls.\n- **For the Sorcerer (Wild Magic):** The weakening seal causes Wild Magic surges in the dungeon. You feel a strange kinship with the chaotic energy here — it responds to you differently than others.\n- **For the Monk (Warrior of Mercy):** The corrupted creatures here are suffering. Your healing hands can ease their torment, and your strikes can bring peace to those beyond saving.\n\n**Adventure Flow:**\n1. **Hook:** Kaelen Ironoak hires the party at a camp outside the Misty Forest\n2. **Small Crypt (30 min):** Combat vs Zombies + Skeletons → find wardstone fragment (clue to anchors)\n3. **Medium Dungeon (45 min):** Combat vs Vine/Twig Blights + terrain hazards → Seal Anchor #1\n4. **Large Keep (60 min):** Social encounter with Brother Aldric → Combat vs Animated Armor + Specter + Cultists → Free Thistle → Seal Anchor #2\n5. **Mega Dungeon (45 min):** Skill challenge (web tunnel navigation) → Combat vs Ettercap + Giant Spiders → Seal Anchor #3\n6. **Ancient Tomb (45 min):** Final boss vs Mother Thorn + Will-o'-Wisp → Reforge/destroy the seal → Conclusion\n7. **Wrap-up (15 min):** Rewards, faction outcomes, epilogue\n\n**Total Expected Duration:** ~4 hours",
    "isPrivate": true,
    "dateCreated": "2026-05-23T00:00:00Z",
    "dateModified": "2026-05-23T00:00:00Z",
    "partyLevel": 3,
    "partyLocation": "Misty Forest"
  },
  {
    "id": "a0000000-0000-4000-a000-000000000002",
    "description": "## Pacing Guide (4-Hour One-Shot)\n\n**0:00 - 0:15 (15 min) — Introduction**\n- Describe the Misty Forest, the camp, the eerie atmosphere\n- Kaelen Ironoak delivers the quest hook (read-aloud text provided)\n- Party can buy basic supplies, ask questions\n- March to Thornfast Keep's entrance\n\n**0:15 - 0:45 (30 min) — Small Crypt**\n- Combat Encounter: Crypt Guardians (Zombies + Skeletons)\n- Loot the crypt for wardstone fragment (clue to seal anchors)\n- Transition via stairs to Medium Dungeon\n\n**0:45 - 1:30 (45 min) — Medium Dungeon / Garrison Halls**\n- Exploration: Describe the overgrown elven garrison\n- Combat Encounter: Twisted Growth (Vine Blights + Twig Blights)\n- Find Seal Anchor #1 (glowing crystal in former meditation garden)\n- Optional: Selena joins if she has accompanied the party\n\n**1:30 - 2:30 (60 min) — Large Keep (Midpoint - Break Recommended Here)**\n- Social Encounter: Brother Aldric and the Thorned Court\n  - Negotiation or combat? Player choice matters\n  - Read Aldric's offer carefully — he is redeemable\n- Combat Encounter: Corrupted Defenders (if negotiations fail)\n- Exploration: Find Thistle the Sprite in the eastern guard room (side quest)\n- Find Seal Anchor #2 in the war room (behind a secret door)\n- Loot: Armory contains basic weapons, 40 gp, Potion of Healing\n\n**2:30 - 3:15 (45 min) — Mega Dungeon / Deep Foundations**\n- Skill Challenge: Web Tunnel Navigation (3 successes before 3 failures)\n- Combat Encounter: Webbed Depths (Ettercap + Giant Spiders)\n- Find Seal Anchor #3 behind the spider nest\n- Treasure: Bag of Holding, 80 gp\n\n**3:15 - 4:00 (45 min) — Ancient Tomb / Final Boss + Wrap-up**\n- Descend to the sealed sanctum\n- **Read-aloud:** Describe the circular chamber, the green crystal, Mother Thorn\n- Final Boss: Two-phase encounter (Mother Thorn → Unstable Seal)\n- **Victory Conditions:** Reforge the seal (3x DC 15 Arcana) OR destroy the crystal\n- Wrap-up: Return to Kaelen, faction rewards, character-specific epilogues\n\n### Tips for Staying on Time\n- If running behind, skip the skill challenge in the Mega Dungeon (just describe the web tunnel) and reduce the Ettercap encounter to just Giant Spiders\n- If ahead of time, add a puzzle: the three seal anchors must be shattered in the right order (found on the wardstone fragment)\n- Offer a short break after the Large Keep (roughly the 2-hour mark)",
    "isPrivate": true,
    "dateCreated": "2026-05-23T00:00:00Z",
    "dateModified": "2026-05-23T00:00:00Z",
    "partyLevel": 3,
    "partyLocation": "Thornfast Keep"
  },
  {
    "id": "a0000000-0000-4000-a000-000000000003",
    "description": "## Treasure Table\n\n### Found Throughout the Dungeon\n\n| Item | Location | Quantity |\n|------|----------|----------|\n| Gold pieces (various chests) | Small Crypt chest, Medium Dungeon altar, Large Keep armory, Mega Dungeon chest | 150 gp total |\n| Potion of Healing | Large Keep armory | 1 |\n| Potion of Healing | Kaelen gives before start | 2 |\n| **Bag of Holding** (Uncommon) | Mega Dungeon chest | 1 |\n\n### By Map\n\n**Small Crypt:**\n- Wardstone fragment (quest item, elven script with anchor locations)\n- 25 gp (assorted ancient coins, rusty but valuable)\n- 1x Scroll of Detect Magic (in the bone chest)\n\n**Medium Dungeon:**\n- Elven journal (lore, hints about the seal anchors)\n- 30 gp (hidden in a hollow log)\n- Seal Anchor #1: When shattered, releases a burst of fey energy (heals all creatures within 20 ft for 1d10 HP)\n\n**Large Keep:**\n- Brother Aldric's key ring (opens Thistle's cage, various doors)\n- 40 gp (armory payroll chest)\n- 1x Potion of Healing (in the medical supplies)\n- Thistle's Pixie Dust (single-use, grants Fly speed 30 ft for 1 minute)\n- Seal Anchor #2: When shattered, reveals a hidden compartment with a Silver Crescent Moon Pendant (quest item for The Guardian's Legacy)\n\n**Mega Dungeon:**\n- **Bag of Holding** (Uncommon magic item — in the spider chest)\n- 80 gp (assorted treasure from the Ettercap's victims)\n- Seal Anchor #3: When shattered, the ground trembles and a secret passage opens to the Ancient Tomb\n\n**Ancient Tomb:**\n- **Goggles of Night** (Uncommon magic item — on a stone pedestal after the seal is reforged)\n- The Thorned One's crown (a twisted black thorn circlet, worth 100 gp to a collector, or can be returned to the Feywild via the Warlock's patron for a favor)\n\n### Quest Rewards (Post-Adventure)\n- **Main Quest:** 150 gp per character, favor of Emerald Wardens\n- **Thistle's Freedom:** Pixie blessing (once per day, the character can add 1d4 to a skill check — lasts until used)\n- **The Guardian's Legacy:** Selena offers a masterwork longbow (+1 to attack rolls, non-magical) or her personal aid in a future endeavor",
    "isPrivate": true,
    "dateCreated": "2026-05-23T00:00:00Z",
    "dateModified": "2026-05-23T00:00:00Z",
    "partyLevel": 3,
    "partyLocation": "Thornfast Keep"
  }
]
